{
  "id": "12",
  "slug": "authentication-rbac",
  "title": "Authentication, Conditional Access, and RBAC",
  "domain": "architecture",
  "objectives": [
    "A21",
    "A23",
    "A24"
  ],
  "duration_minutes": 45,
  "mode": "read-only",
  "resource_profile": "none",
  "status": "offline-validated",
  "assessment_count": 30,
  "source_urls": [
    "https://learn.microsoft.com/en-us/credentials/certifications/resources/study-guides/az-900"
  ],
  "reviewed_on": "2026-10-12"
}
