{
  "id": "03",
  "slug": "consumption-pricing",
  "title": "Consumption and cloud pricing",
  "domain": "cloud",
  "objectives": [
    "C05",
    "C06"
  ],
  "duration_minutes": 40,
  "mode": "concept",
  "resource_profile": "none",
  "status": "offline-validated",
  "assessment_count": 30,
  "source_urls": [
    "https://learn.microsoft.com/en-us/credentials/certifications/resources/study-guides/az-900"
  ],
  "reviewed_on": "2026-10-12"
}
