{
  "id": "20",
  "slug": "azure-monitor",
  "title": "Monitor, logs, alerts, and Application Insights",
  "domain": "management",
  "objectives": [
    "M15"
  ],
  "duration_minutes": 45,
  "mode": "read-only",
  "resource_profile": "none",
  "status": "offline-validated",
  "assessment_count": 30,
  "source_urls": [
    "https://learn.microsoft.com/en-us/credentials/certifications/resources/study-guides/az-900"
  ],
  "reviewed_on": "2026-10-12"
}
