{
  "id": "10",
  "slug": "file-migration",
  "title": "File transfer and migration decisions",
  "domain": "architecture",
  "objectives": [
    "A18",
    "A19"
  ],
  "duration_minutes": 50,
  "mode": "live",
  "resource_profile": "storage",
  "status": "offline-validated",
  "assessment_count": 30,
  "source_urls": [
    "https://learn.microsoft.com/en-us/credentials/certifications/resources/study-guides/az-900"
  ],
  "reviewed_on": "2026-10-12"
}
